178,In Person,Amber Nigam,Masters,Analytics,Job Recommendation: Leveraging Progression of Job ApplicationssangIsCoolhttps://drive.google.com/open?id=1FGXP-TPcVn7YUAUlPv4P3F5V0atPjSO0,"job recommendation, Bi-LSTM with attention, progression, deep learning",Recommendation Engines
179,In Person,Dakshitha B Anandakumar,PhD,Biomedical Engineering,Experience dependent changes in neural coding in the auditory cortexsangIsCoolhttps://drive.google.com/open?id=1_p0z1kWifSL0pWYIp2Iei9Jx_KUENsW6,"Auditory cortex, thalamus, neural coding, maternal behavior",Neuroscience 
180,In Person,Firaz Peer,PhD,Digital Media/LMC,All Data Are Human: The Human Infrastructure of Civic Data InfrastructuressangIsCoolhttps://drive.google.com/open?id=1xqwXU7as33rzFN_UAQWZvf6Er9NOe-g4,"data infrastructures, civic data, human infrastructure, communities, data dash-boards",Human Computer Interaction
181,In Person,Emily Brown,PhD,Biological Sciences,Harmful alga trades off growth & toxicity in response to cues from dead phytoplanktonsangIsCoolhttps://drive.google.com/open?id=1FRXcEfO36NuUokxg8U04lbOH0myyGWGL,"phytoplankton, predator-prey dynamics, chemical cues, chemical defense",Biology
182,In Person,Foroozan Karimzadeh,Masters,Electrical and computer engineering,Hardware-aware Pruning of DNNs using LFSR-Generated Pseudo-Random Indices for Mobile Applications sangIsCoolhttps://drive.google.com/open?id=1-avfGVG3e8bT7K9DJDRwASR6GB3krROP,"Deep neural network, mobile application, sparsity, pruning, hardware.",Data science
183,In Person,Mohammadreza Nazemi,PhD,Mechanical Engineering,ENHANCING THE RATE OF ELECTROCATALYTIC CONVERSION OF N2 TO NH3 USING HYBRID PLASMONIC NANOSTRUCTURESsangIsCoolhttps://drive.google.com/open?id=1GMfwE4Hcmrl4pJ5SNnrONlW_d5gjmM0h,"Nanocatalysis, Hollow gold nanocages, Nitrogen reduction reaction, Ammonia Electrosynthesis, Cage effect","Renewable energy, Fuel, Sustainability"
